{
  "schema_version": "1.0",
  "phase": "phase-0c",
  "request": {
    "head_sha": "fa4b120a5f276d05f1c86f7619ac2b522a7981d4",
    "reference": "https://github.com/Pizza73/RedTeam_Agent/pull/3#issuecomment-5508736487",
    "action": "IMPLEMENT_PHASE"
  },
  "families": [
    {
      "id": "authorization-lifecycle",
      "status": "affected",
      "entry_points": [
        "src/redteam_agent/executor/service.py",
        "src/redteam_agent/repositories/execution.py",
        "src/redteam_agent/executor/adapter.py",
        "src/redteam_agent/data_security/stores.py"
      ],
      "sibling_paths": [
        "src/redteam_agent/data_security/ingestion.py",
        "src/redteam_agent/data_security/streaming.py",
        "src/redteam_agent/repositories/mission.py"
      ],
      "invariant_evidence": [
        "Executor durably consumes and read-back verifies the exact repository-backed Dispatch Claim before Secret decryption or entry into the already-selected Adapter dispatch port.",
        "A crash after Claim consumption is at-most-once: restart from DISPATCH_CLAIMED performs reconciliation only and cannot release Secret plaintext or replay Adapter submission."
      ],
      "tests": [
        "tests/security/test_phase0c_data_security.py",
        "tests/security/test_gate_review_regressions.py"
      ],
      "test_modes": ["positive", "negative", "failure", "property"]
    },
    {
      "id": "secret-plaintext-boundary",
      "status": "affected",
      "entry_points": [
        "src/redteam_agent/executor/service.py",
        "src/redteam_agent/executor/adapter.py",
        "src/redteam_agent/data_security/stores.py",
        "src/redteam_agent/data_security/ingestion.py"
      ],
      "sibling_paths": [
        "src/redteam_agent/data_security/streaming.py",
        "src/redteam_agent/data_security/models.py",
        "src/redteam_agent/repositories/execution.py"
      ],
      "invariant_evidence": [
        "The package exports no Broker, callback, or caller-constructible Secret channel; only Executor's private composition-root-fixed dispatch transaction can reach SecretStore's internal resolver and fixed Adapter port.",
        "The transaction derives the complete Secret set from trusted Decision and Grant repositories after Claim consumption, releases each value once into bounded mutable buffers, and zeroes every buffer on success or failure."
      ],
      "tests": ["tests/security/test_phase0c_data_security.py"],
      "test_modes": ["positive", "negative", "failure"]
    },
    {
      "id": "integrity-cryptography-keys",
      "status": "affected",
      "entry_points": [
        "src/redteam_agent/data_security/stores.py",
        "src/redteam_agent/data_security/keys.py",
        "src/redteam_agent/data_security/generations.py",
        "src/redteam_agent/storage/generation_records.py"
      ],
      "sibling_paths": [
        "src/redteam_agent/data_security/streaming.py",
        "src/redteam_agent/data_security/audit.py"
      ],
      "invariant_evidence": [
        "The durable SQLite generation backend atomically persists HMAC-authenticated anchors and encrypted immutable blobs with generation, state-digest, prior-anchor, namespace, and path-identity bindings.",
        "Production Audit Head and Wrapped Key constructors accept only one shared durable anchor/blob backend; integer-only and in-memory fallbacks are rejected, while restart and tamper tests fail closed."
      ],
      "tests": ["tests/security/test_phase0c_data_security.py"],
      "test_modes": ["positive", "negative", "failure", "property"]
    },
    {
      "id": "audit-recovery-durability",
      "status": "affected",
      "entry_points": [
        "src/redteam_agent/data_security/ingestion.py",
        "src/redteam_agent/executor/service.py"
      ],
      "sibling_paths": [
        "src/redteam_agent/data_security/streaming.py",
        "src/redteam_agent/repositories/execution.py"
      ],
      "invariant_evidence": [
        "Recovery loads and read-back verifies the SecureIngestionManifest, result projection, every referenced Artifact and Secret, and the deletion intent before it constructs a sink or explicitly resumes Quarantine erasure.",
        "After durable ingestion or erasure, Executor rebuilds ExecutionResult from the verified projection and manifest without calling Adapter collection again; Quarantine constructors and lookups perform no recovery writes."
      ],
      "tests": ["tests/security/test_phase0c_data_security.py"],
      "test_modes": ["positive", "negative", "failure", "property"]
    },
    {
      "id": "filesystem-concurrency-retention",
      "status": "affected",
      "entry_points": [
        "src/redteam_agent/data_security/streaming.py",
        "src/redteam_agent/executor/service.py"
      ],
      "sibling_paths": [
        "src/redteam_agent/data_security/keys.py",
        "src/redteam_agent/data_security/ingestion.py"
      ],
      "invariant_evidence": [
        "Executor owns an injected trusted Clock and exposes no caller timestamp on collection or ingestion; one Clock reading persists collection_started_at, retention_until, and the collection lease for restart reuse.",
        "The authority binds the exact ToolRef, Registry digest, Provider task and deterministic sink, and max_result_bytes is the minimum of that ToolDefinition limit and the system hard cap."
      ],
      "tests": ["tests/security/test_phase0c_data_security.py"],
      "test_modes": ["positive", "negative", "failure", "property"]
    },
    {
      "id": "untrusted-output-parsing",
      "status": "affected",
      "entry_points": [
        "src/redteam_agent/data_security/ingestion.py",
        "src/redteam_agent/canonical/json.py"
      ],
      "sibling_paths": [
        "src/redteam_agent/data_security/models.py",
        "src/redteam_agent/data_security/stores.py"
      ],
      "invariant_evidence": [
        "The application coordinator accepts only ingestion_id and loads the canonical Receipt, Execution, Result Collection Authority, Mission and quarantine stream from trusted repositories.",
        "Strict immutable Dispatch Claim, collection authority, manifest, deletion-intent and generation-anchor models reject unknown fields, coercion and digest/row binding changes."
      ],
      "tests": ["tests/security/test_phase0c_data_security.py"],
      "test_modes": ["positive", "negative", "failure"]
    },
    {
      "id": "acceptance-compatibility",
      "status": "affected",
      "entry_points": [
        "src/redteam_agent/data_security/__init__.py",
        "src/redteam_agent/data_security/streaming.py"
      ],
      "sibling_paths": [
        "src/redteam_agent/executor/service.py",
        "src/redteam_agent/data_security/ingestion.py"
      ],
      "invariant_evidence": [
        "The Phase 0B isolated Mock ingester remains an exact test-double exception while non-mock ingestion requires the durable Phase 0C erasure state machine.",
        "Phase 0B flow/safety regressions and Phase 0C positive, denial, crash, restart, retention, path-replacement and corrupt-blob cases remain covered."
      ],
      "tests": [
        "tests/security/test_phase0c_data_security.py",
        "tests/integration/test_phase0b_flow.py"
      ],
      "test_modes": ["positive", "negative", "failure"]
    }
  ],
  "cross_family_tests": [
    "tests/security/test_phase0c_data_security.py",
    "tests/security/test_gate_review_regressions.py",
    "tests/integration/test_phase0b_flow.py"
  ],
  "notes": "This audit is rebound to the current-HEAD Design Approval implementation request. It covers all six retained P1 findings as one durable lifecycle correction: Executor-owned consume-before-decrypt Secret delivery, manifest-and-resource verification before explicit erasure, projection-only post-erasure result recovery, trusted Clock ownership, and a durable production generation backend. No external provider or target action is introduced."
}
